{
  "schema": "prometeo.integration-disposition-ledger/v1",
  "integration_batch_id": "IB-CANARY-01",
  "generation_id": "GEN-CANARY-01",
  "decision_actor_id": "steward-canary-01",
  "source_head_cutoff": "1111111111111111111111111111111111111111",
  "created_at": "2026-09-17T09:12:00-03:00",
  "authority": "PLANNING_CONSUMPTION_ONLY_NOT_PRODUCT_PROMOTION",
  "selection_policy": "EVIDENCE_SCOPED_NO_RECENCY_PRIORITY",
  "entries": [
    {
      "entry_id": "E-R1",
      "return_ref": "coordination/opportunities/returns/O-X/RUN-X.json",
      "source_content_sha256": "aaaaaaaaaaaaaaaaaaaaaaaaaaaaaaaaaaaaaaaaaaaaaaaaaaaaaaaaaaaaaaaa",
      "source_worker_instance_id": "worker-x",
      "source_authority_label": "CANDIDATE_EVIDENCE_ONLY",
      "visibility_state": "DISPOSITIONED",
      "scopes": [
        {
          "scope_id": "planner-contract",
          "semantic_target": "planner/compiler-contract",
          "disposition": "CONSUMED",
          "decision_basis_refs": ["coordination/evidence/steward-decision-1.json"],
          "effect_authority": "PLANNING_CONSUMPTION_ONLY_NOT_PRODUCT_PROMOTION"
        },
        {
          "scope_id": "legacy-route",
          "semantic_target": "planner/legacy-route",
          "disposition": "CONFLICTED",
          "reason": "Same-scope evidence disagrees; keep this scope blocked without rejecting the consumed compiler contract.",
          "decision_basis_refs": ["coordination/evidence/steward-decision-1.json"],
          "conflict_refs": ["coordination/evidence/contradiction-1.json"],
          "effect_authority": "PLANNING_CONSUMPTION_ONLY_NOT_PRODUCT_PROMOTION"
        }
      ]
    },
    {
      "entry_id": "E-R2",
      "return_ref": "coordination/opportunities/returns/O-Y/RUN-Y.json",
      "source_content_sha256": "bbbbbbbbbbbbbbbbbbbbbbbbbbbbbbbbbbbbbbbbbbbbbbbbbbbbbbbbbbbbbbbb",
      "source_worker_instance_id": "worker-y",
      "source_authority_label": "CANDIDATE_EVIDENCE_ONLY",
      "visibility_state": "PENDING_UNREAD",
      "pending_reason": "Return arrived after the pinned cutoff; defer to the next replayable integration batch.",
      "scopes": []
    }
  ]
}
